{
  "$schema": "https://json-schema.org/draft/2020-12/schema",
  "$id": "https://gitlab.com/sentinel/contracts/analysis.schema.json",
  "title": "SentinelIncidentAnalysis",
  "description": "Schema for advisory incident analysis generated by GitLab Duo during Sentinel recovery attempts.",
  "type": "object",
  "required": [
    "schema_version",
    "incident_id",
    "attempt_no",
    "outcome",
    "facts",
    "hypotheses",
    "missing_evidence"
  ],
  "properties": {
    "schema_version": {
      "type": "string",
      "description": "Semantic version of the analysis schema contract.",
      "const": "1.0.0"
    },
    "incident_id": {
      "type": "string",
      "description": "Unique identifier of the incident being investigated."
    },
    "attempt_no": {
      "type": "integer",
      "minimum": 1,
      "description": "The recovery attempt sequence number."
    },
    "outcome": {
      "type": "string",
      "description": "Verdict of the investigation. Must be explicit to support hands-off abort if no safe fix is found.",
      "enum": [
        "fix_proposed",
        "no_fix_found"
      ]
    },
    "facts": {
      "type": "array",
      "description": "Confirmed empirical facts extracted from authoritative evidence items (logs, metrics, probes).",
      "items": {
        "type": "object",
        "required": [
          "fact",
          "evidence_ref"
        ],
        "properties": {
          "fact": {
            "type": "string",
            "description": "Description of the confirmed factual observation."
          },
          "evidence_ref": {
            "type": "string",
            "description": "Concrete pointer to the evidence bundle item or log citation (e.g., 'metrics.json#L42', 'cloudrun-logs/candidate-error.log')."
          }
        },
        "additionalProperties": false
      }
    },
    "hypotheses": {
      "type": "array",
      "description": "Plausible explanations of root cause with qualitative or numeric confidence.",
      "items": {
        "type": "object",
        "required": [
          "hypothesis",
          "confidence"
        ],
        "properties": {
          "hypothesis": {
            "type": "string",
            "description": "Hypothesized mechanism of failure."
          },
          "confidence": {
            "type": "string",
            "description": "Subjective confidence level based on available evidence.",
            "enum": [
              "low",
              "medium",
              "high"
            ]
          },
          "rationale": {
            "type": "string",
            "description": "Explanation supporting this hypothesis."
          }
        },
        "additionalProperties": false
      }
    },
    "missing_evidence": {
      "type": "array",
      "description": "Information or logs that would be needed to prove or refute hypotheses but were absent in the evidence bundle.",
      "items": {
        "type": "string"
      }
    },
    "suspected_change": {
      "type": "object",
      "description": "Commit or diff hunk suspected of introducing the regression.",
      "properties": {
        "commit_sha": {
          "type": "string",
          "description": "The commit hash suspected of introducing the fault."
        },
        "file_path": {
          "type": "string",
          "description": "File path where regression is believed to originate."
        },
        "line_range": {
          "type": "string",
          "description": "Estimated line numbers or diff range."
        },
        "reason": {
          "type": "string",
          "description": "Why this specific change is suspected."
        }
      },
      "additionalProperties": false
    },
    "proposed_fix_summary": {
      "type": "string",
      "description": "High-level summary of the proposed code repair and regression test strategy. Required when outcome is 'fix_proposed'."
    },
    "regression_test_strategy": {
      "type": "object",
      "description": "Details regarding the new regression test designed to reproduce the failure.",
      "properties": {
        "test_file": {
          "type": "string",
          "description": "Path to the regression test under tests/regressions/."
        },
        "expected_failure_type": {
          "type": "string",
          "description": "Expected failure on broken commit (must be an assertion failure)."
        }
      },
      "additionalProperties": false
    }
  },
  "if": {
    "properties": {
      "outcome": {
        "const": "fix_proposed"
      }
    }
  },
  "then": {
    "required": [
      "proposed_fix_summary",
      "suspected_change"
    ]
  },
  "additionalProperties": false
}
